Chapter number,Topic number,Paper number,Questions,Answers
Chapter 11,Topic 6 - Waves 01 - Wave properties,Paper 2,What unit is frequency measured in?,hertz (Hz)
Chapter 11,Topic 6 - Waves 01 - Wave properties,Paper 2,What property of a wave always stays the same when it travels from one medium to another?,frequency
Chapter 11,Topic 6 - Waves 01 - Wave properties,Paper 2,What rule do waves follow when they reflect off a surface?,angle of incidence = angle of reflection
Chapter 11,Topic 6 - Waves 01 - Wave properties,Paper 2,What happens when waves are transmitted at a boundary between two substances?,they carry on moving at a different speed
Chapter 11,Topic 6 - Waves 01 - Wave properties,Paper 2,What happens when waves are absorbed by a substance?,energy of the wave is transferred to energy stores of the substance
Chapter 12,Topic 6 - Waves 02 - EM spectrum,Paper 2,Are electromagnetic (EM) waves longitudinal or transverse waves?,transverse
Chapter 12,Topic 6 - Waves 02 - EM spectrum,Paper 2,Explain why EM waves are not mechanical waves.,they can travel through a vacuum (don’t need a substance to travel through)
Chapter 12,Topic 6 - Waves 02 - EM spectrum,Paper 2,What do EM waves transfer from their source to an absorber?,energy
Chapter 12,Topic 6 - Waves 02 - EM spectrum,Paper 2,List the different types of waves in the EM spectrum in order of decreasing wavelength (increasing frequency).,"radio, microwave, infrared, visible, ultraviolet, X-rays, gamma"
Chapter 12,Topic 6 - Waves 02 - EM spectrum,Paper 2,Which part of the EM spectrum can humans see?,visible light
Chapter 12,Topic 6 - Waves 02 - EM spectrum,Paper 2,How can electromagnetic waves be produced?,changes inside an atom/atomic nucleus
Chapter 12,Topic 6 - Waves 02 - EM spectrum,Paper 2,How are gamma rays produced?,"changes in the nucleus of an atom, for example during radioactive decay"
Chapter 12,Topic 6 - Waves 02 - EM spectrum,Paper 2,How can radio waves be produced?,oscillations in an electrical circuit
Chapter 12,Topic 6 - Waves 02 - EM spectrum,Paper 2,How can we detect radio waves?,waves are absorbed and create an alternating current with the same frequency as the radio wave
Chapter 12,Topic 6 - Waves 02 - EM spectrum,Paper 2,What are radio waves used for?,"transmitting television, mobile phone, and Bluetooth signals"
Chapter 12,Topic 6 - Waves 02 - EM spectrum,Paper 2,What are microwaves used for?,"satellite communications, cooking food"
Chapter 12,Topic 6 - Waves 02 - EM spectrum,Paper 2,What is infrared radiation used for?,"heating, remote controls, infrared cameras, cooking food"
Chapter 12,Topic 6 - Waves 02 - EM spectrum,Paper 2,Which types of EM waves are harmful to the human body?,"ultraviolet, X-rays, gamma rays"
Chapter 12,Topic 6 - Waves 02 - EM spectrum,Paper 2,What are the hazards of being exposed to ultraviolet radiation?,"damage skin cells, sunburn, increase risk of skin cancer, age skin prematurely, blindness"
Chapter 12,Topic 6 - Waves 02 - EM spectrum,Paper 2,Why are X-rays used for medical imaging?,they pass through flesh but not bone
Chapter 12,Topic 6 - Waves 02 - EM spectrum,Paper 2,Why are gamma rays used for treating cancer and sterilising medical equipment?,high doses kill cells and bacteria
Chapter 13,Topic 7 - Electromagnetism,Paper 2,What is a magnetic field?,the region of space around a magnet where a magnetic material will experience a force
Chapter 13,Topic 7 - Electromagnetism,Paper 2,What happens when like and unlike poles are brought together?,"like = repel, unlike = attract"
Chapter 13,Topic 7 - Electromagnetism,Paper 2,What happens to the strength of the magnetic field as you get further away from the magnet?,decreases
Chapter 13,Topic 7 - Electromagnetism,Paper 2,Where is the magnetic field of a magnet strongest?,at the poles
Chapter 13,Topic 7 - Electromagnetism,Paper 2,In which direction do magnetic field lines always point?,north to south
Chapter 13,Topic 7 - Electromagnetism,Paper 2,What does the distance between magnetic field lines indicate?,"strength of the field, closer together = stronger field"
Chapter 13,Topic 7 - Electromagnetism,Paper 2,What is a permanent magnet?,material that produces its own magnetic field
Chapter 13,Topic 7 - Electromagnetism,Paper 2,What is an induced magnet?,material that becomes magnetic when it is put in a magnetic field
Chapter 13,Topic 7 - Electromagnetism,Paper 2,What does a magnetic compass contain?,small bar magnet
Chapter 13,Topic 7 - Electromagnetism,Paper 2,What is produced around a wire when an electric current flows through it?,magnetic field
Chapter 13,Topic 7 - Electromagnetism,Paper 2,What factors does the strength of the magnetic field around a straight wire depend upon?,"size of current, distance from wire"
Chapter 13,Topic 7 - Electromagnetism,Paper 2,What effect does shaping the wire into a solenoid have on the magnetic field strength?,increases strength of magnetic field
Chapter 13,Topic 7 - Electromagnetism,Paper 2,How can the strength of the magnetic field inside a solenoid be increased?,put an iron core inside
Chapter 13,Topic 7 - Electromagnetism,Paper 2,What does Fleming’s left-hand rule show?,"relative orientation of the force, current in the conductor, and magnetic field for the motor effect"
Chapter 13,Topic 7 - Electromagnetism,Paper 2,What is the symbol for magnetic flux density and what unit is it measured in?,"B, tesla (T)"
Chapter 13,Topic 7 - Electromagnetism,Paper 2,What is the motor effect?,when a conductor placed in a magnetic field experiences a force
Chapter 13,Topic 7 - Electromagnetism,Paper 2,What causes the motor effect?,interaction between the magnetic field created by current in a wire and the magnetic field in which the wire is placed
Chapter 13,Topic 7 - Electromagnetism,Paper 2,What do loudspeakers and headphones do?,use the motor effect to convert variations in current in electrical circuits to pressure variations in sound waves
